Unique ID	Identifiers	Set Identifiers	Name	Rarity	Functional Text	Flavor Text	Type Text	Artists	Variations	Variation Unique IDs	Image URLs
pBpLPQ7kg6mkBpNMMPdCD	1HP000	1HP	Cuore di Fyendal	F	"**Leggendaria** *(Puoi avere solo 1 Cuore di Fyendal nel tuo mazzo.)*

Quando lanci Cuore di Fyendal, se hai meno {h} del tuo avversario, guadagna 1{h}."		Generica Risorsa – Gemma	Adolfo Navarro	R - 1HP000 - N	gqTfggK6mrJwr9hMKwDWh - 1HP000 - N	https://storage.googleapis.com/fabmaster/cardfaces/2022-1HP/IT/IT_1HP000_1.png - 1HP000 - N
N77hdGp96fNQnzc79hqN9	1HP000	1HP	Occhio di Ophidia	F	"**Leggendaria** *(Puoi avere solo 1 Occhio di Ophidia nel tuo mazzo.)*

Quando lanci Occhio di Ophidia, **opta 2**."		Generica Risorsa – Gemma	Alexandra Malygina	R - 1HP000 - N	FNpT9W8cRMtNDjTtbMHKp - 1HP000 - N	https://storage.googleapis.com/fabmaster/cardfaces/2022-1HP/IT/IT_1HP000_2.png - 1HP000 - N
pkMGCRh9fDT98dRgnQF8W	1HP000	1HP	Frammento del Cavaliere Oscuro	F	"**Specializzazione leggendaria di Viserai** *(Puoi avere solo 1 Frammento del Cavaliere Oscuro nel tuo mazzo, e solo se il tuo eroe è Viserai.)*

Quando lanci Frammento del Cavaliere Oscuro, crea una pedina Canto Runico."		Lamederune Ressource – Pierre précieuse	Maxim Kostin	R - 1HP000 - N	6bHjcdPFjtzC8cBJjKcnQ - 1HP000 - N	https://storage.googleapis.com/fabmaster/cardfaces/2022-1HP/IT/IT_1HP000_3.png - 1HP000 - N
