Unique ID	Identifiers	Set Identifiers	Name	Rarity	Types	Card Keywords	Abilities and Effects	Ability and Effect Keywords	Granted Keywords	Functional Text	Flavor Text	Type Text	Variations	Image URLs
MT9nz8PHJbcKjDLjBQpRB	1HP000	1HP000	Herz von Fyendal	F	Allgemein, Ressource, Edelstein	Legendär				"**Legendär** *(Du darfst Herz von Fyendal nur einmal in deinem Deck haben.)*

Wenn du Herz von Fyendal pitchst und weniger {h} als ein gegnerischer Held hast, erhälst du 1{h}."		Allgemein Ressource – Edelstein	R – 1HP000 – N	https://storage.googleapis.com/fabmaster/cardfaces/2022-1HP/DE/DE_1HP000_1.png – 1HP000 – N
BhnHFqrfDwMkwLpkBhtTh	1HP000	1HP000	Auge von Ophidia	F	Allgemein, Ressource, Edelstein	Legendär, sortiere 2 um				"**Legendär** *(Du darfst Auge von Ophidia nur einmal in deinem Deck haben.)*

Wenn du Auge von Ophidia pitchst, **sortiere 2 um**."		Allgemein Ressource – Edelstein	R – 1HP000 – N	https://storage.googleapis.com/fabmaster/cardfaces/2022-1HP/DE/DE_1HP000_2.png – 1HP000 – N
JbDpk8RWBfWGJbm6d8M8W	1HP000	1HP000	Scherbe der Erznacht	F	Runenklinge, Ressource, Edelstein	Viserai-Spezialisierung, Legendär				"**Legendäre Viserai-Spezialisierung** *(Du darfst Scherbe der Erznacht nur einmal in deinem Deck haben und nur dann, wenn Viserai dein Held ist.)*

Wenn du Scherbe der Erznacht pitchst, erstelle ein Runengesang-Token."		Runenklinge Ressource – Edelstein	R – 1HP000 – N	https://storage.googleapis.com/fabmaster/cardfaces/2022-1HP/DE/DE_1HP000_3.png – 1HP000 – N
